{
  "id": "job_0edge001",
  "status": "pending",
  "created_at": "2026-08-18T10:31:00Z",
  "updated_at": "2026-08-18T10:31:00Z",
  "attempts": 0,
  "input": {
    "audio_file_id": "1edgeAAAAAAAAAAAAAAAAAAAAAAAAAAAA",
    "audio_filename": "Em của ngày hôm qua.mp3",
    "audio_duration": null,
    "language": "vi",
    "has_lyrics_input": false,
    "lyrics_file_id": null,
    "upload_folder_id": "1edgeFolderBBBBBBBBBBBBBBBBBBBBBB"
  },
  "config": {
    "demucs_model": "htdemucs_ft",
    "whisper_model": "large-v3",
    "video_template": "modern",
    "video_resolution": "1080p",
    "font": "Be Vietnam Pro",
    "highlight_color": "#00D4FF",
    "background_color": "#1A1A2E",
    "guide_vocal": false,
    "guide_vocal_volume": 0
  },
  "progress": {
    "current_stage": "waiting",
    "stages": {
      "audio_separation": {
        "status": "pending",
        "progress": 0
      },
      "lyrics_alignment": {
        "status": "pending",
        "progress": 0
      },
      "video_render": {
        "status": "pending",
        "progress": 0
      }
    },
    "message": "Đang chờ worker xử lý...",
    "worker_id": null,
    "started_at": null,
    "heartbeat_at": null
  },
  "checkpoints": {
    "audio_separated": false,
    "lyrics_aligned": false,
    "video_rendered": false
  },
  "output": {
    "output_folder_id": null,
    "instrumental_file_id": null,
    "vocals_file_id": null,
    "lyrics_json_file_id": null,
    "video_file_id": null
  },
  "error": null
}
